{
    "name": "auto_NO_kennycomix.com_xw4",
    "vendorUrl": "https://www.kennycomix.com/",
    "cosmetic": false,
    "runContext": {
        "main": true,
        "frame": false,
        "urlPattern": "^https?://(www\\.)?kennycomix\\.com/"
    },
    "prehideSelectors": [],
    "detectCmp": [
        {
            "exists": "body > div:not([id]) > div:not([id]) > div:nth-child(1):not([id]) > div:nth-child(2):not([id]) > button:nth-child(2):not([id])"
        }
    ],
    "detectPopup": [
        {
            "visible": "body > div:not([id]) > div:not([id]) > div:nth-child(1):not([id]) > div:nth-child(2):not([id]) > button:nth-child(2):not([id])"
        }
    ],
    "optIn": [],
    "optOut": [
        {
            "wait": 500
        },
        {
            "waitForThenClick": "body > div:not([id]) > div:not([id]) > div:nth-child(1):not([id]) > div:nth-child(2):not([id]) > button:nth-child(2):not([id])",
            "comment": "Decline All"
        }
    ],
    "test": [
        {
            "waitForVisible": "body > div:not([id]) > div:not([id]) > div:nth-child(1):not([id]) > div:nth-child(2):not([id]) > button:nth-child(2):not([id])",
            "timeout": 1000,
            "check": "none"
        }
    ]
}
