{
    "name": "auto_CH_syna.ch_l3h",
    "vendorUrl": "https://syna.ch/",
    "cosmetic": false,
    "runContext": {
        "main": true,
        "frame": false,
        "urlPattern": "^https?://(www\\.)?syna\\.ch/"
    },
    "prehideSelectors": [],
    "detectCmp": [
        {
            "exists": "body > div#redim-cookiehint > div:nth-child(2):not([id]) > a:nth-child(2)#cookiehintsubmitno"
        }
    ],
    "detectPopup": [
        {
            "visible": "body > div#redim-cookiehint > div:nth-child(2):not([id]) > a:nth-child(2)#cookiehintsubmitno"
        }
    ],
    "optIn": [],
    "optOut": [
        {
            "wait": 500
        },
        {
            "waitForThenClick": "body > div#redim-cookiehint > div:nth-child(2):not([id]) > a:nth-child(2)#cookiehintsubmitno",
            "comment": "Ablehnen"
        }
    ],
    "test": [
        {
            "waitForVisible": "body > div#redim-cookiehint > div:nth-child(2):not([id]) > a:nth-child(2)#cookiehintsubmitno",
            "timeout": 1000,
            "check": "none"
        }
    ]
}
