{
    "name": "auto_AU_hays.com.au_nv3",
    "vendorUrl": "https://www.hays.com.au/",
    "cosmetic": false,
    "runContext": {
        "main": false,
        "frame": true,
        "urlPattern": "^https?://(www\\.)?consent-pref\\.trustarc\\.com/"
    },
    "prehideSelectors": [],
    "detectCmp": [
        {
            "exists": "body:not([id]) > div:not([id]) > div:nth-child(1):not([id]) > div:not([id]) > div:nth-child(4):not([id]) > a:nth-child(3):not([id])"
        }
    ],
    "detectPopup": [
        {
            "visible": "body:not([id]) > div:not([id]) > div:nth-child(1):not([id]) > div:not([id]) > div:nth-child(4):not([id]) > a:nth-child(3):not([id])"
        }
    ],
    "optIn": [],
    "optOut": [
        {
            "wait": 500
        },
        {
            "waitForThenClick": "body:not([id]) > div:not([id]) > div:nth-child(1):not([id]) > div:not([id]) > div:nth-child(4):not([id]) > a:nth-child(3):not([id])",
            "comment": "Required Only"
        }
    ],
    "test": [
        {
            "waitForVisible": "body:not([id]) > div:not([id]) > div:nth-child(1):not([id]) > div:not([id]) > div:nth-child(4):not([id]) > a:nth-child(3):not([id])",
            "timeout": 1000,
            "check": "none"
        }
    ]
}
