{
    "name": "auto_FR_livebox-news.com_ey1",
    "vendorUrl": "https://livebox-news.com/",
    "cosmetic": false,
    "runContext": {
        "main": true,
        "frame": false,
        "urlPattern": "^https?://(www\\.)?livebox-news\\.com/"
    },
    "prehideSelectors": [],
    "detectCmp": [
        {
            "exists": "body > div#sliding-popup > div:not([id]) > div:nth-child(2):not([id]) > div:not([id]) > div:nth-child(2):not([id]) > div:not([id]) > div#manage-cookies-modal > div:nth-child(3):not([id]) > div#popup-buttons > button:nth-child(2):not([id])"
        }
    ],
    "detectPopup": [
        {
            "visible": "body > div#sliding-popup > div:not([id]) > div:nth-child(2):not([id]) > div:not([id]) > div:nth-child(2):not([id]) > div:not([id]) > div#manage-cookies-modal > div:nth-child(3):not([id]) > div#popup-buttons > button:nth-child(2):not([id])"
        }
    ],
    "optIn": [],
    "optOut": [
        {
            "wait": 500
        },
        {
            "waitForThenClick": "body > div#sliding-popup > div:not([id]) > div:nth-child(2):not([id]) > div:not([id]) > div:nth-child(2):not([id]) > div:not([id]) > div#manage-cookies-modal > div:nth-child(3):not([id]) > div#popup-buttons > button:nth-child(2):not([id])",
            "comment": "Cookies nÃ©cessaires"
        }
    ],
    "test": [
        {
            "waitForVisible": "body > div#sliding-popup > div:not([id]) > div:nth-child(2):not([id]) > div:not([id]) > div:nth-child(2):not([id]) > div:not([id]) > div#manage-cookies-modal > div:nth-child(3):not([id]) > div#popup-buttons > button:nth-child(2):not([id])",
            "timeout": 1000,
            "check": "none"
        }
    ]
}
