{
    "name": "auto_GB_change.org_0",
    "vendorUrl": "https://www.change.org/",
    "cosmetic": false,
    "runContext": {
        "main": true,
        "frame": false,
        "urlPattern": "^https?://(www\\.)?change\\.org/"
    },
    "prehideSelectors": [],
    "detectCmp": [
        {
            "exists": "body:not([id]) > div#rootApp > div:nth-child(3):not([id]) > div:not([id]) > div:not([id]) > div:nth-child(2):not([id]) > div:nth-child(2):not([id]) > div:nth-child(1):not([id]) > button:nth-child(2):not([id])"
        }
    ],
    "detectPopup": [
        {
            "visible": "body:not([id]) > div#rootApp > div:nth-child(3):not([id]) > div:not([id]) > div:not([id]) > div:nth-child(2):not([id]) > div:nth-child(2):not([id]) > div:nth-child(1):not([id]) > button:nth-child(2):not([id])"
        }
    ],
    "optIn": [],
    "optOut": [
        {
            "waitForThenClick": "body:not([id]) > div#rootApp > div:nth-child(3):not([id]) > div:not([id]) > div:not([id]) > div:nth-child(2):not([id]) > div:nth-child(2):not([id]) > div:nth-child(1):not([id]) > button:nth-child(2):not([id])",
            "comment": "Reject non-essential cookies"
        }
    ]
}