{
    "name": "lineagrafica",
    "vendorUrl": "https://addons.prestashop.com/en/legal/8734-eu-cookie-law-gdpr-banner-blocker.html",
    "cosmetic": true,
    "prehideSelectors": [
        "#lgcookieslaw_banner,#lgcookieslaw_modal,#lgcookieslaw-modal,#lgcookieslaw-overlay,.lgcookieslaw-overlay,.lgcookieslaw_overlay"
    ],
    "detectCmp": [
        {
            "exists": "#lgcookieslaw_banner,#lgcookieslaw_modal,#lgcookieslaw-modal,#lgcookieslaw-overlay,.lgcookieslaw-overlay,.lgcookieslaw_overlay"
        }
    ],
    "detectPopup": [
        {
            "exists": "#lgcookieslaw_banner,#lgcookieslaw_modal,#lgcookieslaw-modal,#lgcookieslaw-overlay,.lgcookieslaw-overlay,.lgcookieslaw_overlay"
        }
    ],
    "optIn": [
        {
            "waitForThenClick": "#lgcookieslaw_accept"
        }
    ],
    "optOut": [
        {
            "hide": "#lgcookieslaw_banner,#lgcookieslaw_modal,#lgcookieslaw-modal,#lgcookieslaw-overlay,.lgcookieslaw-overlay,.lgcookieslaw_overlay"
        }
    ]
}
