{
    "name": "auto_GB_rcgp.org.uk_vw7",
    "cosmetic": false,
    "runContext": {
        "main": true,
        "frame": false,
        "urlPattern": "^https?://(www\\.)?rcgp\\.org\\.uk/"
    },
    "prehideSelectors": [],
    "detectCmp": [
        {
            "exists": "body > div#cookie > div:nth-child(2):not([id]) > div:nth-child(2):not([id]) > button:nth-child(2)#cookie-rejected"
        }
    ],
    "detectPopup": [
        {
            "visible": "body > div#cookie > div:nth-child(2):not([id]) > div:nth-child(2):not([id]) > button:nth-child(2)#cookie-rejected"
        }
    ],
    "optIn": [],
    "optOut": [
        {
            "wait": 500
        },
        {
            "waitForThenClick": "body > div#cookie > div:nth-child(2):not([id]) > div:nth-child(2):not([id]) > button:nth-child(2)#cookie-rejected",
            "comment": "Reject"
        }
    ],
    "test": [
        {
            "waitForVisible": "body > div#cookie > div:nth-child(2):not([id]) > div:nth-child(2):not([id]) > button:nth-child(2)#cookie-rejected",
            "timeout": 1000,
            "check": "none"
        }
    ]
}
