{
    "name": "auto_CH_schweiztipps.ch_k9g",
    "vendorUrl": "https://www.schweiztipps.ch/",
    "cosmetic": false,
    "runContext": {
        "main": true,
        "frame": false,
        "urlPattern": "^https?://(www\\.)?schweiztipps\\.ch/"
    },
    "prehideSelectors": [],
    "detectCmp": [
        {
            "exists": "body > div#a6fe9cf42-9398-41df-b212-b18203f0feca > dialog:not([id]) > div:not([id]) > div:not([id]) > div:nth-child(3):not([id]) > div:nth-child(1):not([id]) > div:nth-child(2):not([id]) > a:nth-child(2):not([id])"
        }
    ],
    "detectPopup": [
        {
            "visible": "body > div#a6fe9cf42-9398-41df-b212-b18203f0feca > dialog:not([id]) > div:not([id]) > div:not([id]) > div:nth-child(3):not([id]) > div:nth-child(1):not([id]) > div:nth-child(2):not([id]) > a:nth-child(2):not([id])"
        }
    ],
    "optIn": [],
    "optOut": [
        {
            "wait": 500
        },
        {
            "waitForThenClick": "body > div#a6fe9cf42-9398-41df-b212-b18203f0feca > dialog:not([id]) > div:not([id]) > div:not([id]) > div:nth-child(3):not([id]) > div:nth-child(1):not([id]) > div:nth-child(2):not([id]) > a:nth-child(2):not([id])",
            "comment": "Weiter ohne Einwilligung"
        }
    ],
    "test": [
        {
            "waitForVisible": "body > div#a6fe9cf42-9398-41df-b212-b18203f0feca > dialog:not([id]) > div:not([id]) > div:not([id]) > div:nth-child(3):not([id]) > div:nth-child(1):not([id]) > div:nth-child(2):not([id]) > a:nth-child(2):not([id])",
            "timeout": 1000,
            "check": "none"
        }
    ]
}
