{
    "name": "auto_NL_fvd.nl_kio",
    "vendorUrl": "https://fvd.nl/",
    "cosmetic": false,
    "runContext": {
        "main": true,
        "frame": false,
        "urlPattern": "^https?://(www\\.)?fvd\\.nl/"
    },
    "prehideSelectors": [],
    "detectCmp": [
        {
            "exists": "body > div#__nuxt > div:not([id]) > div:nth-child(5):not([id]) > div:nth-child(2):not([id]) > div:nth-child(2):not([id]) > button:nth-child(2):not([id])"
        }
    ],
    "detectPopup": [
        {
            "visible": "body > div#__nuxt > div:not([id]) > div:nth-child(5):not([id]) > div:nth-child(2):not([id]) > div:nth-child(2):not([id]) > button:nth-child(2):not([id])"
        }
    ],
    "optIn": [],
    "optOut": [
        {
            "wait": 500
        },
        {
            "waitForThenClick": "body > div#__nuxt > div:not([id]) > div:nth-child(5):not([id]) > div:nth-child(2):not([id]) > div:nth-child(2):not([id]) > button:nth-child(2):not([id])",
            "comment": "Weiger"
        }
    ],
    "test": [
        {
            "waitForVisible": "body > div#__nuxt > div:not([id]) > div:nth-child(5):not([id]) > div:nth-child(2):not([id]) > div:nth-child(2):not([id]) > button:nth-child(2):not([id])",
            "timeout": 1000,
            "check": "none"
        }
    ]
}
