{
    "name": "auto_GB_npg.org.uk_cny",
    "vendorUrl": "https://www.npg.org.uk/",
    "cosmetic": false,
    "runContext": {
        "main": true,
        "frame": false,
        "urlPattern": "^https?://(www\\.)?npg\\.org\\.uk/"
    },
    "prehideSelectors": [],
    "detectCmp": [
        {
            "exists": "body:not([id]) > div#CybotCookiebotDialog > div:not([id]) > div:nth-child(4)#CybotCookiebotDialogFooter > div:nth-child(1):not([id]) > div#CybotCookiebotDialogBodyButtons > div:nth-child(2)#CybotCookiebotDialogBodyButtonsWrapper > button:nth-child(1)#CybotCookiebotDialogBodyButtonDecline"
        }
    ],
    "detectPopup": [
        {
            "visible": "body:not([id]) > div#CybotCookiebotDialog > div:not([id]) > div:nth-child(4)#CybotCookiebotDialogFooter > div:nth-child(1):not([id]) > div#CybotCookiebotDialogBodyButtons > div:nth-child(2)#CybotCookiebotDialogBodyButtonsWrapper > button:nth-child(1)#CybotCookiebotDialogBodyButtonDecline"
        }
    ],
    "optIn": [],
    "optOut": [
        {
            "wait": 500
        },
        {
            "waitForThenClick": "body:not([id]) > div#CybotCookiebotDialog > div:not([id]) > div:nth-child(4)#CybotCookiebotDialogFooter > div:nth-child(1):not([id]) > div#CybotCookiebotDialogBodyButtons > div:nth-child(2)#CybotCookiebotDialogBodyButtonsWrapper > button:nth-child(1)#CybotCookiebotDialogBodyButtonDecline",
            "comment": "Deny"
        }
    ],
    "test": [
        {
            "waitForVisible": "body:not([id]) > div#CybotCookiebotDialog > div:not([id]) > div:nth-child(4)#CybotCookiebotDialogFooter > div:nth-child(1):not([id]) > div#CybotCookiebotDialogBodyButtons > div:nth-child(2)#CybotCookiebotDialogBodyButtonsWrapper > button:nth-child(1)#CybotCookiebotDialogBodyButtonDecline",
            "timeout": 1000,
            "check": "none"
        }
    ]
}
