{
    "name": "auto_CA_global.craft.co_63o",
    "vendorUrl": "https://global.craft.co/",
    "cosmetic": false,
    "runContext": {
        "main": true,
        "frame": false,
        "urlPattern": "^https?://(www\\.)?global\\.craft\\.co/"
    },
    "prehideSelectors": [],
    "detectCmp": [
        {
            "exists": "body:not([id]) > div:not([id]) > div:nth-child(1)#cookie-law-info-bar > div:not([id]) > span:nth-child(2)#wt-cli-cookie-banner > div:not([id]) > div:nth-child(1):not([id]) > div:nth-child(5):not([id]) > a:not([id])"
        }
    ],
    "detectPopup": [
        {
            "visible": "body:not([id]) > div:not([id]) > div:nth-child(1)#cookie-law-info-bar > div:not([id]) > span:nth-child(2)#wt-cli-cookie-banner > div:not([id]) > div:nth-child(1):not([id]) > div:nth-child(5):not([id]) > a:not([id])"
        }
    ],
    "optIn": [],
    "optOut": [
        {
            "wait": 500
        },
        {
            "waitForThenClick": "body:not([id]) > div:not([id]) > div:nth-child(1)#cookie-law-info-bar > div:not([id]) > span:nth-child(2)#wt-cli-cookie-banner > div:not([id]) > div:nth-child(1):not([id]) > div:nth-child(5):not([id]) > a:not([id])",
            "comment": "Do not sell my personal information"
        }
    ],
    "test": [
        {
            "waitForVisible": "body:not([id]) > div:not([id]) > div:nth-child(1)#cookie-law-info-bar > div:not([id]) > span:nth-child(2)#wt-cli-cookie-banner > div:not([id]) > div:nth-child(1):not([id]) > div:nth-child(5):not([id]) > a:not([id])",
            "timeout": 1000,
            "check": "none"
        }
    ]
}
