{
    "name": "auto_FR_croisieurope.com_k77",
    "vendorUrl": "https://www.croisieurope.com/",
    "cosmetic": false,
    "runContext": {
        "main": true,
        "frame": false,
        "urlPattern": "^https?://(www\\.)?croisieurope\\.com/"
    },
    "prehideSelectors": [],
    "detectCmp": [
        {
            "exists": "body > div#modal-bg > div:not([id]) > div:not([id]) > div:nth-child(3):not([id]) > button:nth-child(1):not([id])"
        }
    ],
    "detectPopup": [
        {
            "visible": "body > div#modal-bg > div:not([id]) > div:not([id]) > div:nth-child(3):not([id]) > button:nth-child(1):not([id])"
        }
    ],
    "optIn": [],
    "optOut": [
        {
            "wait": 500
        },
        {
            "waitForThenClick": "body > div#modal-bg > div:not([id]) > div:not([id]) > div:nth-child(3):not([id]) > button:nth-child(1):not([id])",
            "comment": "REFUSER"
        }
    ],
    "test": [
        {
            "waitForVisible": "body > div#modal-bg > div:not([id]) > div:not([id]) > div:nth-child(3):not([id]) > button:nth-child(1):not([id])",
            "timeout": 1000,
            "check": "none"
        }
    ]
}
