{
    "name": "auto_DE_sparkasse-ulm.de_8zl",
    "vendorUrl": "https://www.sparkasse-ulm.de/de/home.html",
    "cosmetic": false,
    "runContext": {
        "main": true,
        "frame": false,
        "urlPattern": "^https?://(www\\.)?sparkasse-ulm\\.de/"
    },
    "prehideSelectors": [],
    "detectCmp": [
        {
            "exists": "body > div:not([id]) > div:nth-child(19):not([id]) > div:nth-child(2):not([id]) > div:not([id]) > div:not([id]) > div:nth-child(2):not([id]) > a:nth-child(2):not([id])"
        }
    ],
    "detectPopup": [
        {
            "visible": "body > div:not([id]) > div:nth-child(19):not([id]) > div:nth-child(2):not([id]) > div:not([id]) > div:not([id]) > div:nth-child(2):not([id]) > a:nth-child(2):not([id])"
        }
    ],
    "optIn": [],
    "optOut": [
        {
            "wait": 500
        },
        {
            "waitForThenClick": "body > div:not([id]) > div:nth-child(19):not([id]) > div:nth-child(2):not([id]) > div:not([id]) > div:not([id]) > div:nth-child(2):not([id]) > a:nth-child(2):not([id])",
            "comment": "Ablehnen"
        }
    ],
    "test": [
        {
            "waitForVisible": "body > div:not([id]) > div:nth-child(19):not([id]) > div:nth-child(2):not([id]) > div:not([id]) > div:not([id]) > div:nth-child(2):not([id]) > a:nth-child(2):not([id])",
            "timeout": 1000,
            "check": "none"
        }
    ]
}
