{
    "name": "auto_GB_beersofeurope.co.uk_tt2",
    "vendorUrl": "https://www.beersofeurope.co.uk/",
    "cosmetic": false,
    "runContext": {
        "main": true,
        "frame": false,
        "urlPattern": "^https?://(www\\.)?beersofeurope\\.co\\.uk/"
    },
    "prehideSelectors": [],
    "detectCmp": [
        {
            "exists": "body:not([id]) > div#bs-cookie-settings > div#bs-cookie-wrapper > div:nth-child(1)#bs-cookie-bar > div:not([id]) > div#c-inr > div:nth-child(2)#c-bns > button:nth-child(2)#c-s-bn"
        }
    ],
    "detectPopup": [
        {
            "visible": "body:not([id]) > div#bs-cookie-settings > div#bs-cookie-wrapper > div:nth-child(1)#bs-cookie-bar > div:not([id]) > div#c-inr > div:nth-child(2)#c-bns > button:nth-child(2)#c-s-bn"
        }
    ],
    "optIn": [],
    "optOut": [
        {
            "waitForThenClick": "body:not([id]) > div#bs-cookie-settings > div#bs-cookie-wrapper > div:nth-child(1)#bs-cookie-bar > div:not([id]) > div#c-inr > div:nth-child(2)#c-bns > button:nth-child(2)#c-s-bn",
            "comment": "Reject all"
        }
    ]
}
