{
    "name": "auto_NL_fixpart.nl_c64",
    "vendorUrl": "https://fixpart.nl/",
    "cosmetic": false,
    "runContext": {
        "main": true,
        "frame": false,
        "urlPattern": "^https?://(www\\.)?fixpart\\.nl/"
    },
    "prehideSelectors": [],
    "detectCmp": [
        {
            "exists": "body > div:not([id]) > div:not([id]) > div:not([id]) > div:not([id]) > div:nth-child(1):not([id]) > p:nth-child(2):not([id]) > a:nth-child(3):not([id])"
        }
    ],
    "detectPopup": [
        {
            "visible": "body > div:not([id]) > div:not([id]) > div:not([id]) > div:not([id]) > div:nth-child(1):not([id]) > p:nth-child(2):not([id]) > a:nth-child(3):not([id])"
        }
    ],
    "optIn": [],
    "optOut": [
        {
            "wait": 500
        },
        {
            "waitForThenClick": "body > div:not([id]) > div:not([id]) > div:not([id]) > div:not([id]) > div:nth-child(1):not([id]) > p:nth-child(2):not([id]) > a:nth-child(3):not([id])",
            "comment": "essentiÃ«le cookies"
        }
    ],
    "test": [
        {
            "waitForVisible": "body > div:not([id]) > div:not([id]) > div:not([id]) > div:not([id]) > div:nth-child(1):not([id]) > p:nth-child(2):not([id]) > a:nth-child(3):not([id])",
            "timeout": 1000,
            "check": "none"
        }
    ]
}
