{
    "name": "auto_GB_eurail.com_0",
    "vendorUrl": "https://www.eurail.com/en",
    "cosmetic": false,
    "runContext": {
        "main": true,
        "frame": false,
        "urlPattern": "^https?://(www\\.)?eurail\\.com/"
    },
    "prehideSelectors": [],
    "detectCmp": [
        {
            "exists": "body#home-page-b71f1fad76 > div#CybotCookiebotDialog > div:not([id]) > div:nth-child(4)#CybotCookiebotDialogFooter > div:nth-child(1):not([id]) > div#CybotCookiebotDialogBodyButtons > div:nth-child(2)#CybotCookiebotDialogBodyButtonsWrapper > button:nth-child(1)#CybotCookiebotDialogBodyButtonDecline"
        }
    ],
    "detectPopup": [
        {
            "visible": "body#home-page-b71f1fad76 > div#CybotCookiebotDialog > div:not([id]) > div:nth-child(4)#CybotCookiebotDialogFooter > div:nth-child(1):not([id]) > div#CybotCookiebotDialogBodyButtons > div:nth-child(2)#CybotCookiebotDialogBodyButtonsWrapper > button:nth-child(1)#CybotCookiebotDialogBodyButtonDecline"
        }
    ],
    "optIn": [],
    "optOut": [
        {
            "waitForThenClick": "body#home-page-b71f1fad76 > div#CybotCookiebotDialog > div:not([id]) > div:nth-child(4)#CybotCookiebotDialogFooter > div:nth-child(1):not([id]) > div#CybotCookiebotDialogBodyButtons > div:nth-child(2)#CybotCookiebotDialogBodyButtonsWrapper > button:nth-child(1)#CybotCookiebotDialogBodyButtonDecline",
            "comment": "Use necessary cookies only"
        }
    ]
}
