{
    "name": "auto_AU_morgans.com.au_jgz",
    "vendorUrl": "https://morgans.com.au/",
    "cosmetic": false,
    "runContext": {
        "main": true,
        "frame": false,
        "urlPattern": "^https?://(www\\.)?morgans\\.com\\.au/"
    },
    "prehideSelectors": [],
    "detectCmp": [
        {
            "exists": "body:not([id]) > div:not([id]) > main:nth-child(2):not([id]) > section:nth-child(8):not([id]) > div:nth-child(4):not([id]) > div:not([id]) > div:not([id]) > div:nth-child(2):not([id]) > a:nth-child(2):not([id])"
        }
    ],
    "detectPopup": [
        {
            "visible": "body:not([id]) > div:not([id]) > main:nth-child(2):not([id]) > section:nth-child(8):not([id]) > div:nth-child(4):not([id]) > div:not([id]) > div:not([id]) > div:nth-child(2):not([id]) > a:nth-child(2):not([id])"
        }
    ],
    "optIn": [],
    "optOut": [
        {
            "wait": 500
        },
        {
            "waitForThenClick": "body:not([id]) > div:not([id]) > main:nth-child(2):not([id]) > section:nth-child(8):not([id]) > div:nth-child(4):not([id]) > div:not([id]) > div:not([id]) > div:nth-child(2):not([id]) > a:nth-child(2):not([id])",
            "comment": "Deny"
        }
    ],
    "test": [
        {
            "waitForVisible": "body:not([id]) > div:not([id]) > main:nth-child(2):not([id]) > section:nth-child(8):not([id]) > div:nth-child(4):not([id]) > div:not([id]) > div:not([id]) > div:nth-child(2):not([id]) > a:nth-child(2):not([id])",
            "timeout": 1000,
            "check": "none"
        }
    ]
}
