{
    "name": "auto_DE_hansgrohe.de_14n",
    "vendorUrl": "https://www.hansgrohe.de/",
    "cosmetic": false,
    "runContext": {
        "main": true,
        "frame": false,
        "urlPattern": "^https?://(www\\.)?hansgrohe\\.de/"
    },
    "prehideSelectors": [],
    "detectCmp": [
        {
            "exists": "body > div:not([id]) > form:not([id]) > div:not([id]) > div:not([id]) > div:not([id]) > div:nth-child(3):not([id]) > div:not([id]) > section:nth-child(1):not([id]) > div:nth-child(2):not([id]) > button:nth-child(2):not([id])"
        }
    ],
    "detectPopup": [
        {
            "visible": "body > div:not([id]) > form:not([id]) > div:not([id]) > div:not([id]) > div:not([id]) > div:nth-child(3):not([id]) > div:not([id]) > section:nth-child(1):not([id]) > div:nth-child(2):not([id]) > button:nth-child(2):not([id])"
        }
    ],
    "optIn": [],
    "optOut": [
        {
            "wait": 500
        },
        {
            "waitForThenClick": "body > div:not([id]) > form:not([id]) > div:not([id]) > div:not([id]) > div:not([id]) > div:nth-child(3):not([id]) > div:not([id]) > section:nth-child(1):not([id]) > div:nth-child(2):not([id]) > button:nth-child(2):not([id])",
            "comment": "Alles ablehnen"
        }
    ],
    "test": [
        {
            "waitForVisible": "body > div:not([id]) > form:not([id]) > div:not([id]) > div:not([id]) > div:not([id]) > div:nth-child(3):not([id]) > div:not([id]) > section:nth-child(1):not([id]) > div:nth-child(2):not([id]) > button:nth-child(2):not([id])",
            "timeout": 1000,
            "check": "none"
        }
    ]
}
